{
  "version": 1,
  "policy_id": "synthetic-default-deny",
  "command_ids": [],
  "command_registry_hash": "4f53cda18c2baa0c0354bb5f9a3ecbe5ed12ab4d8e11ba873c2f11161202b945",
  "max_diff_bytes": 2097152,
  "max_file_bytes": 524288,
  "max_output_bytes": 65536,
  "max_wall_time_ms": 300000,
  "policy_hash": "db6601b5ac8f7a0e64bc6b01ffbec65d3e9c5c7575a9706d7101322ea592aa06"
}
